{"$schema":"http://json-schema.org/draft-07/schema#","$id":"https://agentic-website-studio.local/schemas/human-expansion-replaytest-gate.schema.json","type":"object","required":["schemaVersion","gateId","status","bindings","preview","supportBoundary","humanEvaluation","availableHumanActions"],"properties":{"schemaVersion":{"const":"1.0.0"},"gateId":{"const":"expansion_replaytest_gate_wayfinder_m43r_01"},"projectId":{"type":"string"},"status":{"const":"pending_human_expansion_replaytest"},"bindings":{"type":"object"},"preview":{"type":"object"},"supportBoundary":{"type":"object"},"automatedQaEstablished":{"type":"array"},"knownWarnings":{"type":"array"},"humanEvaluation":{"type":"array","minItems":13,"maxItems":13},"availableHumanActions":{"type":"array","minItems":3,"maxItems":3}}}
